{
  "schema": "starcar-artifact/1",
  "kind": "returned",
  "subject": "a84d35af573e0a7d1",
  "session_id": "8a347c36-20b4-427a-ae0b-46855aa7bb72",
  "at": "2026-07-27T16:22:45Z",
  "outcome": "done",
  "findings": "Section 0 answers BOTH - behavioural half in prose here, format half (identity key, required set, join rule, precedence, ambiguity, dedup) specified as an executable deliverable of 11 named conformance vectors and NOT held in prose, binding on the landed ruling at artifacts/reviews/2026-07-24-dual-runtime-design-review-round3-REJECT.md line 77 that identity, join keys, dedup and ambiguity are format and prose cannot hold them. THE CONDUCTOR PREMISE IS FALSE AND MEASURED SO. PR-1, the load-bearing new probe - shape B placed in front of a REAL runtime-id family dispatch rather than the empty store the round-1 reviewer used, renders cars empty and declaredNotObserved carrying d87-car-r1 and d87-review-r1 while the same wire simultaneously carries a returned record subject aaaaaaaaaaaaaaaaa outcome done taskId d87-car-r1, with ZERO board conditions. The board asserts a member has not departed while holding its returned record. That is Law 1's named worst case and a worse class than shape A's silent drop, so the reviewer's R1-M1 alternative was measured only in the epoch where it cannot be wrong. PR-2, same store same run, a minted-id family train renders full consist, filled gates lane, assigned true, zero conditions, with no change to anything - member identity is a solved non-problem for that family, so the crisis is one family's launch event not carrying the shop handle, which is adapter territory. PR-3, two distinct runtime subjects both returning task_id dup-handle-r1 both render with zero conditions - no ambiguity guard exists and any handle-keyed join inherits the hole. PR-4, the landed legacy corpus is 6 manifests, 10 distinct member subjects all runtime ids, owning 16 returned records of which ZERO carry task_id, and a legacy-shaped manifest binds and renders fully today - so the fallback clause protects RENDERING and not merely validation. PR-5, 97 captured live launch payloads, every tool_input key set exactly description-model-prompt-subagent_type with description populated 97 of 97, carrying prose not the handle - a dedicated conductor-authored key exists and the C3R-1e ruling forbids parsing the free-text prompt, not reading a field that exists. PR-6, a real dispatched record carries no task_id while its returned sibling does. PREMISES ATTACKED - P1 one field two masters FALSE, the single-field pressure comes from the consumer at assemble.go 304-307 and was promoted to a law of the format; P2 half survives, equality yes but not on the identity field; P3 string survives deliberately; P4 FALSE and stronger, no identity amendment exists to perform; P5 FALSE and dissolves the most; and three premises nobody had written down - P6 the binding must be written at launch, false for returned and true for in-flight, which reduces the entire shape A versus shape B argument to one missing wire; P7 the conductor will reliably amend, on which both rejected shapes silently depend; P8 one problem one shape, false by PR-2. DECISIONS - a member is identified by its shop-minted task-id and never carries a runtime id, the binding is DERIVED by the assembler and never declared or amended, the anyOf is kept but justified by NO-BACKFILL rather than by shape A's reason, a declared member always renders, an unattributed dispatch is disclosed, ambiguity is shown never resolved by precedence, and the in-flight wire is separable so the design stands whether or not it lands. TWO SELF-DISCLOSURES - I wrote a 0-byte untracked file into the SHARED CHECKOUT because Set-Location does not change .NET CurrentDirectory, which also made that fault-injection run vacuous; removed, shared checkout verified clean, redone correctly with absolute paths and watched to red by name. And section 2b is a disclosed addition to the template's section order because the template has no home for probes that succeeded. VERIFICATION - CitationResolverPolicy plus DocPolicy plus CodeCitationPolicy 43 passed 0 failed 4 skipped at the committed tree; the citation gate scans git ls-files only so my first green never saw the untracked file and proved nothing, corrected by staging then fault-injecting docs/constitution.md:99999 and observing the named red at design file line 55, restored byte-identical sha256 4B3AC3ADB16B6E9D20B9B32B217476C2C3BB9E10BF4E5B496B8E2EF0BBC552D5; scripts/tests 223 passed 0 failed 4 skipped. One dead citation caught and fixed before commit - the round-1 verdict cites StoreIntegrity.Tests.ps1 bare and it lives under scripts/store-checks not scripts/tests. Six real open questions carry costs, and Q6 invites attack on my own section 0 split.",
  "abstract": "Design rung 1 for issue 87, manifest member identity, authored in worktree design-87 on branch design/member-identity-87 over base 51fb403 and committed at 9e18799ace9332d6d4b472bb2d46a77f1666bf5c as docs/design/2026-07-27-manifest-member-identity-design.md, 564 lines, single file, board untouched so no collision with the in-flight freight work, nothing pushed. Section 0 rules BOTH and keeps the format half out of prose on the strength of a landed prior verdict. The conductor's central premise - that a member's identity lives in one field serving two masters - was attacked and measured false: the pressure comes from a 10-line consumer function that reads exactly one member key, and that accident of code was promoted into a property of the format. Six probes ran against a board server built from source over sealed scratch stores, all landed in a new section 2b with a re-derivation recipe. The decisive one reframes the rejected shapes: shape B, measured against a real runtime-id dispatch instead of an empty store, renders a returned member as declared-not-observed with zero conditions, a Law 1 confident falsehood rather than the cosmetic placeholder cost the owner's ruling recorded, while shape A degrades to Law 4 silent loss - both correct only while a human remembers to amend. The design removes the amendment entirely: a member is named by the shop-minted task-id it already has, never by a runtime fact, and the plan-to-actual binding is derived by the assembler from data both sides already carry, with an explicit legacy clause proven necessary by measurement over the landed corpus and an ambiguity disclosure proven absent today. Three previously unstated premises were surfaced and attacked, one of which localises the whole shape A versus shape B disagreement to a single missing launch-time wire that 97 captured payloads show a dedicated field already available for. Two self-disclosures are on the record, including a write into the shared checkout that also rendered one fault injection vacuous, caught, cleaned, and redone under observation.",
  "subject_basis": "runtime-id",
  "task_id": "design-87-r1",
  "producer": "starcar-hook/1",
  "normalisation": [],
  "integrity": "sha256:fd17e579b26cd1a839b5c25c186e4679902def246868577fe03e5e8d3c09a202"
}
