{
  "schema": "starcar-artifact/1",
  "kind": "dispatched",
  "subject": "a01ab6d06808d2ab4",
  "session_id": "64c15364-0933-4d6d-9b2e-d1ddbc918f9f",
  "at": "2026-07-23T13:20:29Z",
  "model": "claude-opus-4-8[1m]",
  "producer": "starcar-hook/1",
  "normalisation": [],
  "integrity": "sha256:8f977db28465d0044045a77c069a250375d72c1c45aaaf73bc7eec1694f88b85"
}
