{
  "schema": "starcar-artifact/1",
  "kind": "dispatched",
  "subject": "accbde6200eebcfc4",
  "session_id": "64c15364-0933-4d6d-9b2e-d1ddbc918f9f",
  "at": "2026-07-23T15:07:53Z",
  "model": "claude-opus-4-8[1m]",
  "producer": "starcar-hook/1",
  "normalisation": [],
  "integrity": "sha256:6585d080f55400466105a1437decdbff31d5430ac7c0b0ce567af43f73144886"
}
