{
  "schema": "starcar-artifact/1",
  "kind": "returned",
  "subject": "a7fbcee7ccaec45d8",
  "session_id": "15c84ef1-8e84-4d98-aacd-17cce34752cb",
  "at": "2026-07-26T17:18:07Z",
  "outcome": "REJECT",
  "findings": "1 Major, 3 Minor, 2 Notes; all 11 round-1 findings CLOSED. MAJOR M-4 (NEW, revealed by 3e267e2's own fix): worked-adversary-and-gate-briefs.md:88, the plan adversary's heading, delegates its verdict shape to worked-plan.md's review record - \"see worked-plan.md's review record for the verdict shape\" - and worked-plan.md was not touched by this delta. worked-plan.md:169 is titled \"The plan-review record (rule 5) - what the adversary hunts, and the verdict shape\" and carries at :171-181 the SAME rung's dimension list as (a) through (e) while 3e267e2 changed the brief's copy to (a) through (g), and at :183-189 the verdict shape itself with neither BASE-DELTA nor an unreproducible-evidence line, and at :191-192 the words \"the re-review verifies the delta; the verdict history stays in the plan\" - the delta-re-review path, at the plan rung, the rung where the drill that produced ticket 13 actually ran. A conductor who writes a plan re-review brief from section 3, follows the pointer at :88, and writes the verdict in the shape found there produces a verdict with no BASE-DELTA while having followed both templates correctly. Classified NEW rather than M-1 DRIFTED because M-1's named remedy landed completely in all five carriers I named. I disclose my own round-1 miss: my search pattern was \"VERDICT:|verdict template|reviewer brief|Reviewer brief\" and worked-plan.md says \"the verdict shape\" and \"The plan-review record\" and matched none of them - I faulted the car for a glob that could not see a file, using a pattern that could not see a file, same class one directory over. MINOR m-8: design-briefs.md:137-139 says a finding built on a gitignored probe log \"was recorded as closed with no flag that the closure itself was unverifiable by anyone else\" - drill:66 records that finding as DRIFTED into C2R2-M1, not closed, and drill:105 says it \"was recorded honestly as UNVERIFIABLE, not papered over\"; the drill's complaint at :110 was placement, \"it lives buried in a table cell\", never absence of disclosure, so the WHY inverts a landed verdict's praise of a prior reviewer into an accusation; the same commit's parallel WHY at worked-adversary-and-gate-briefs.md:119-120 states it correctly. MINOR m-9: 3e267e2's message claims \"lettered ATTACK SURFACE items for the design adversary\" but they are unlettered standalone blocks after (h) at :37-42; the shape choice is correct since a reporting obligation is not an attack surface, only the description is wrong, so the remedy is a record correction not a code change. MINOR m-10: the plan adversary's (f) and (g) at :100-109 run six and four lines against one terse clause for each of (a) through (e), and (f) duplicates justification the [WHY] block at :115-121 already carries, against both files' stated convention that reasoning lives in bracketed WHY blocks deleted when copying - structure correct, voice not. NOTES: \"eight rows, one per document\" is loose since two rows bundle several documents and one is not a document; the fiction's section 11 says round 2 APPROVED while section 10 now carries two NOT CARRIED rows describing what the new paragraph calls a real if small defect. ROUND-1 WALK, all CLOSED and each re-verified at 000111b: M-1 both fields in all five named carriers in genuinely native shapes with every VERDICT line amended and a RECORD CORRECTION paragraph in the commit; M-2 the ledger row now says no mutable process state with 0 to 0 arithmetic quoting section 5 verbatim and still teaching the mandatory-none-row discipline; M-3 both rows NOT CARRIED and re-derived by my own grep - threshold tokens only at :23 header, :41, :60, :70 with section 3 silent, and \"never the browser clock alone\" only at :22 - plus the car extended the fix to row 5 unasked; m-1 REPORT THE OBSERVED VALUES landed; m-2 the conditional now agrees with the field definition; m-3 the paired agent definition carries the visual-guard clause; m-4 now cites the real design's section 8 with eight rows, which I counted at :252-259; m-5 the heading reads folded not closed; m-6 the drill quote is now a contiguous verbatim substring in source order with no ellipses, walked word for word; m-7 names both gaps; N-1 credits the human eye per #33's own account. RULINGS ASKED FOR: native shapes CONFIRMED not pastes; VERDICT lines internally consistent wherever one exists, section 3 having none is M-4; the \"they ARE the exemplar\" framing is HONEST TEACHING not spin on four grounds including that the Known fallibility disclosure is kept rather than displaced; cold-reader re-test finds no new ambiguity and the NOT CARRIED rows are readable without the verdict in hand. SUITES at 000111b: scripts/tests 181 passed 0 failed 1 skipped 182 total, store-checks 178 of 178, DocPolicy 2 of 2 green, tree clean. CONVERGENCE: 3 Majors to 1, all 11 prior findings closed, three fixed beyond the finding; two swirl triggers technically fire (same-area clustering, a fix-revealed defect) but Majors are declining sharply and the clustering is structural to a placement ticket, so I SET A CAP rather than escalate - round 3 must produce a mechanically derived complete inventory of every reviewer-brief and verdict-shape carrier in the repo, enumerating docs/templates and .claude/agents in full and opening each, marked has-both-fields or not-applicable-and-why; fixing worked-plan.md alone does not clear the cap; failing to produce the inventory escalates to the owner rather than to round 4. NOT MERGEABLE from 000111b, but the blocker is isolated: #40 and #9 are both clean, and all four round-2 findings sit on the #13 commit chain, one file plus three text corrections.",
  "abstract": "Round-2 delta re-review of four fix commits (7cf2e48, 3e267e2, c7e263e, 000111b) against round 1's eleven findings at base 71d0c25. All eleven are closed with verifiable evidence, three of them fixed beyond what the finding asked. REJECT on one new Major: the plan adversary brief delegates its verdict shape to worked-plan.md, which this delta did not touch, so the plan rung - the rung where the drill that produced ticket 13 actually ran - still has a verdict shape with neither new field, and its dimension list now diverges from the brief's. Round 1 missed this file for the same reason the car's original search did, which I disclose. Three Minors: a WHY block that inverts a landed verdict's account of a prior reviewer, a commit message that mis-describes its own diff, and a voice mismatch in the plan adversary's new dimensions. All suites green and re-derived independently. Cap set on the search-completeness class rather than escalating. #9 disposition restated and strengthened: its own scope is now complete and correct.",
  "subject_basis": "runtime-id",
  "task_id": "process-docs-review-r2",
  "producer": "starcar-hook/1",
  "normalisation": [],
  "integrity": "sha256:954eb31f7edc6037aa144148ca42e70ee03ad0188016affbbd75db7a03e9eea1"
}
