{
  "schema": "starcar-artifact/1",
  "kind": "dispatched",
  "subject": "ac7d81bda8f23f2a6",
  "session_id": "64c15364-0933-4d6d-9b2e-d1ddbc918f9f",
  "at": "2026-07-23T11:06:47Z",
  "model": "claude-opus-4-8[1m]",
  "producer": "starcar-hook/1",
  "normalisation": [],
  "integrity": "sha256:d1bffa56cabb2a16925a833e67ea7d1eca27aa1741ad80bbb3f33ba97e8dff05"
}
