{
  "schema": "starcar-artifact/1",
  "kind": "dispatched",
  "subject": "a076bf6c0a94e302f",
  "session_id": "15c84ef1-8e84-4d98-aacd-17cce34752cb",
  "at": "2026-07-26T16:29:35Z",
  "budget": 1800.0,
  "model": "claude-sonnet-5",
  "subject_basis": "runtime-id",
  "producer": "starcar-hook/1",
  "normalisation": [],
  "integrity": "sha256:3190811381419682c6e2582ad1e227a24a055542b18791f44ba79ffed168c096"
}
