{
  "schema": "starcar-artifact/1",
  "kind": "returned",
  "subject": "2026-07-22-plan-review-car1-round1",
  "session_id": "pre-harness-migration",
  "at": "2026-07-22T09:02:29-04:00",
  "outcome": "REJECT",
  "findings": "7 Major, 8 Minor",
  "abstract": "|\n  Plan adversary verdict on docs/plans/2026-07-22-harness-car1-plan.md at base\n  4267371992cb9d1d3f3d239f4d2829f470b7f014 (car base d70069e, its parent). Baselines\n  independently re-derived and CONFIRMED: Pester 21 passing, Verify-Verdict 11/11 exit 0.\n\n  Dimension (c) is CLEAN for snippets: I ran the A.1 Pester block verbatim, red and green.\n  Should -BeTrue, -BeIn, -BeGreaterThan, -Because, Should -Not -Throw,\n  System.IO.Path ChangeExtension, and git rev-parse --show-toplevel inside BeforeAll all\n  exist and bind in Pester 5.8.0. NO snippet calls a nonexistent API. Board.psm1:194,\n  Verify-Verdict.ps1:24 and :87-90, and ci.yml:47 all resolve as cited.\n\n  MAJOR 1 (execution defect): plan:150-151 asserts as \"verified at d70069e\" that\n  Verify-Verdict.ps1:94-96 exits 0 on a directory with zero .md files. Measured: it THROWS\n  PropertyNotFoundStrict at :94 and exits 1, because Set-StrictMode Latest at :27 meets a\n  null pipeline result at :91. Lines 95-96 are unreachable dead code. A.3's stated red is\n  therefore wrong, and the test A.3 specifies (empty dir must exit non-zero) PASSES ON\n  ARRIVAL. Spec section 6's mandatory non-vacuity item is unsatisfiable as written.\n\n  MAJOR 2: A.1's Produces block drops 3 of the 6 schema-owned contracts named at spec:96-97\n  (ordering, index format, normalisation substitution rule) plus 5 spec-mandated fields\n  (integrity hash spec:161-163, normalisation declaration spec:156-157, budget spec:139,\n  presumed-lost basis spec:142-143, envelope absent/malformed spec:75-77). Car 2 consumes\n  this blind; A.4's byte-identical determinism gate depends on the ordering A.1 never\n  specifies.\n\n  MAJOR 3: section 3.2 vocabularies-as-data is claimed covered and is not delivered. No\n  vocabulary data file exists in any Car 1 task, and the hard kind enum contradicts\n  spec:125-126, which requires an unrecognised value to be a discovery, not a bug.\n\n  MAJOR 4: R1 fixes draft 2020-12 but names no validation engine. Measured: Test-Json does\n  NOT exist in Windows PowerShell 5.1 (this box) and DOES work correctly on draft 2020-12\n  in pwsh 7.6.3 (what CI uses, ci.yml:42). Verify-Verdict.ps1:20 declares standing 5.1\n  compatibility. The car must choose between a CI-only module and a hand-rolled second copy\n  of the schema (Law 6) - a menu, which spec:57-58 already ruled is not a requirement.\n\n  MAJOR 5: A.5's ledger says \"0 fields, no mutable SERVICE state\", restoring the\n  process-state-only narrowing that spec ruling 6 (spec:195) exists to forbid, and dropping\n  spec:249's append-only-under-git claim. The zero-row ledger does NOT survive A.4, which\n  lands a committed derived artifact with a real staleness lifecycle and no ledger row.\n\n  MAJOR 6: RequireNonEmpty default-off rests on a false premise. docs/reviews holds 11 md\n  files at base, so default-ON also leaves ci.yml:47 green and untouched. Default-off ships\n  a disarmed guard whose arming depends on Car 3 remembering, with no test enforcing it.\n\n  MAJOR 7: subject required always plus dispatch_id required on dispatch kinds is a double\n  identity key, against folded minor m6 at spec:108-109 and Law 6.\n\n  Minors: ci.yml:62 miscited (the vacuity refusal is :76-81); A.5 has only Step 5, no steps\n  1-4; A.2 return shape hashtable vs Board.psm1:188-191 pscustomobject; A.2/A.3/A.4 carry no\n  snippets against worked-plan.md:79-80, and A.2's table-driven instruction walks into the\n  Pester 5 discovery-time ForEach trap; Test-StarcarArtifact has no schema parameter; the\n  state-ledger.md:4 and gating-matrix.md:4 trigger lines are invalidated but absent from\n  A.5's Files list; the gating matrix Evidence column is unsatisfiable at Car 1 for 2 of 3\n  rows; \"section 9 documentation rows (Cars 2 and 3)\" is wrong, rows 1-2 are Car 1's.\n\n  Ruling on R1: legitimate instrument, defective as issued. The JSON-Schema-plus-portable-\n  vectors decision and the A.1/A.2 product-vs-implementation split are sound and are the\n  plan's best idea. It fails because it rules on form while skipping feasibility, claims to\n  avoid inventing a toolchain while requiring an undeclared runtime floor, leaves a menu the\n  spec forbade, does not enumerate the product it declares, and contradicts section 3.2.\n\n  Constitution check: Laws 1, 4, 5 and 6 are each violated with named evidence; Laws 2 and 8\n  are honored; Laws 3 and 7 partial.\n\n  WORKFLOW VERDICT on worked-plan.md: six holes, the first newly paid for this round. Its\n  self-check says \"open the real file\"; reading Verify-Verdict.ps1 produces exactly the\n  plan's false claim, because the StrictMode crash is invisible to reading and took one\n  command to expose. The exemplar must require the plan-writer to RUN every behavioural red.\n  Also missing: a runtime/toolchain floor field; a Produces shape for data contracts as\n  opposed to function signatures; a statement that its own compression is an exemplar\n  artifact and not a licence to under-specify; subsection-granular coverage tables; and\n  ledger guidance that asks about derived committed artifacts, not just process state.\n\n  Model probe: 3 findings are execution defects (Majors 1 and 6, Minor 1), all sharing one\n  root - claims verified by reading where running was required. I judge this at least as\n  attributable to exemplar hole 1, which never instructed the plan-writer to run anything,\n  as to the model. Recommend closing hole 1 and re-measuring before moving cars 2-3.\n\n  Read-only compliance: nothing edited, committed, or pushed. Fault injection was one\n  untracked test file and a temporary schema tree, both removed; git status porcelain empty\n  and HEAD unchanged at 4267371992cb9d1d3f3d239f4d2829f470b7f014.",
  "body_file": "reviews/2026-07-22-plan-review-car1-round1.md",
  "normalisation": [],
  "integrity": "sha256:650b59b3a75150757f85592acf0457098edbd2eba94eadf4320431efa9efadd5"
}
