{
  "schema": "starcar-artifact/1",
  "kind": "dispatched",
  "subject": "ac99647694fc5795c",
  "session_id": "64c15364-0933-4d6d-9b2e-d1ddbc918f9f",
  "at": "2026-07-22T22:18:03Z",
  "model": "claude-sonnet-5",
  "producer": "starcar-hook/1",
  "normalisation": [],
  "integrity": "sha256:3fb0924608c08db0ad9a2425faeaca34230e6688da91f4fc5f4caebbad406ae7"
}
