{
  "schema": "starcar-artifact/1",
  "kind": "returned",
  "subject": "aa9858b26c4f2f91e",
  "session_id": "15c84ef1-8e84-4d98-aacd-17cce34752cb",
  "at": "2026-07-27T03:36:27Z",
  "outcome": "APPROVE",
  "findings": "0 Major, 0 Minor, 2 Notes. Round 1 was 1 Major / 3 Minor; round 2 was 1 Major / 1 Minor.\n  MAJOR-R2-1 PRESENT (fixed), re-derived by the reviewer rather than read: deleting \"if (train.declaredNotObserved.length > 0) return false;\" at 4b97749 now yields 43 tests 42 pass 1 fail in render.test.js (169 to 168 whole-dir), the failing test being the queued pin with verbatim \"AssertionError: a train with an undelivered manifest member must render regardless of recency, actual false, expected true\". The identical deletion was 73/73 GREEN at c5858df, which was precisely the round-2 finding. Guard re-armed.\n  MINOR-R2-1 PRESENT (fixed): render.test.js:620's fixture car now carries outcome 'done', a wire-realistic shape; one edit closed both findings as instructed.\n  NOTE-3 PRESENT (fixed): verify-lane-filters.mjs:78 captures document.querySelector('.car-outcome.register-needs-attention') and :93-95 emit text, class and getComputedStyle color. Re-ran the harness: hotOutcomeChipColor rgb(255, 74, 58). I CHALLENGED the unambiguity claim rather than accepting it - on the live page there are 5 .car-outcome elements and the hot selector matches exactly 1, the other 4 being done/register-nominal, so the comment's claim is true.\n  FULL AXIS SWEEP re-run, not just the one finding: declaredNotObserved guard RED (42/43, self-naming); outcomeRegister axis RED (2 tests, hot-error and unrecognised-word, verbatim reasons); cars.length guard RED (1 test, zero-car); stateRegister axis GREEN, which is expected and correct - in round 2 NOTE-1 I stated this conjunct cannot be isolated by any wire-realistic fixture and explicitly did NOT ask for its removal, and the car documented it at isTrainTerminal instead of papering over it. Every claim in that comment verified: assemble.go:113-114 is the ONLY assignment to a TrainCar Outcome and is guarded by state==\"returned\"; upstream board/fold/algorithm.go:214 sets entry.Outcome only inside case \"returned\"; schema/starcar-artifact.schema.json requires outcome/findings/abstract for kind=returned, pinned by vector invalid-returned-missing-outcome.json; and the stated malformed-feed scenario (state overdue with outcome done) really would reintroduce MAJOR-R1-1 if the conjunct were removed. Correct disposition of an unpinnable guard: keep it and leave a note so a future round does not read FI-green as dead code.\n  NOTE-R3-1 the commit message quotes sha256 058780bef... as \"before and after\" for its injection cycle; that is c5858df's render.js hash, truthful for the moment the cycle ran (before the isolation comment was added) but not the committed file's hash, which is B15A0DF3.... Naming which state a quoted hash belongs to would remove the ambiguity. Substance independently confirmed by my own re-derivation at HEAD.\n  NOTE-R3-2 verify-lane-filters.mjs uses querySelector (first match) for the hot chip; unambiguous today at 1 of 5 measured, but a future fixture adding a second hot outcome would silently pick one. The script is explicitly evidence and never a gate, so this is a maintenance note only.",
  "abstract": "Round 3 delta re-review of 4b97749 (parent c5858df verified) under the cap I set in round 2. Zero Majors, so the cap does not trigger and I rule on the merits: APPROVE. Byte-clean exit - render.js SHA256 B15A0DF3655147E7B073C9EE016AF8CFCFAC90F1234CC6ED015958A32E715E77 identical before and after four fault injections, git status empty, stash empty, HEAD unchanged, nothing committed or pushed. THE DECISIVE CHECK WAS RE-DERIVED, NOT READ: deleting the declaredNotObserved guard now produces 42 of 43 in render.test.js with the queued pin failing for its exact stated reason, where the identical deletion went 73/73 green at c5858df - the round-2 finding is closed and the inverse is measured in both directions. I re-ran my ENTIRE round-2 axis sweep rather than only the named finding, confirming the fix armed one axis without disarming another: three of four predicate guards now fail under isolated injection, and the fourth (stateRegister) is green exactly as I predicted and sanctioned in round 2, now documented in code as defence-in-depth against a wire shape the schema forbids today. Every claim in that new comment was opened and verified through both chain links (fold/algorithm.go:214 sets Outcome only for returned winners; assemble.go:113-114 is the only TrainCar Outcome assignment and is state-guarded; the artifact schema requires outcome for kind=returned with a conformance vector pinning it), and the stated malformed-feed regression scenario checks out. SUITES at 4b97749: Node board/web 169/169 pass 0 fail 0 skipped; Pester scripts/tests 227 total 222 passed 0 failed 5 skipped with the fifth being the predicted detached-HEAD skip; citation gates 41 passed 4 informational skips 0 failed; probes 24/24; probe-yard-snapshot PASS exit 0; zero .go files in the diff verified by file list and not re-run per instruction. FULL-DIFF AUDIT confirms the scoped four paths only and ZERO coordinate-shaped citations introduced - every added reference is by filename or symbol and each was opened. #40 floor now satisfied by the COMMITTED harness itself rather than only by a reviewer's probe: hotOutcomeChipColor rgb(255, 74, 58) equal to the needs-attention token, on a register-nominal car chip, which is the round-1 defect shape surviving the cap; I challenged the selector's unambiguity claim and measured 1 match of 5 .car-outcome elements. Screenshot opened and read - hot-outcome train renders first with a red error chip, trains summary carries the owner's no-noun wording, store path normalised with no operator home directory leaked. CONVERGENCE: 1 Major / 3 Minor, then 1 Major / 1 Minor, then 0 and 0 - declining monotonically in count and severity, the round-2 finding closed by the exact prescribed edit, no new defect introduced. Every swirl trigger that fired in round 2 has cleared and the cap retires unused. Merge-message block, final BASE-DELTA against 7b05cb7, and the CI note (no run exists for the car branch; conductor watches post-merge to a terminal conclusion) are supplied in the verdict body.",
  "subject_basis": "runtime-id",
  "task_id": "view-67-review-r3",
  "producer": "starcar-hook/1",
  "normalisation": [],
  "integrity": "sha256:5a8955e96caa72c955890a61d7c48daee8a2e448e8e878409cd524a476793afa"
}
