{
  "schema": "starcar-artifact/1",
  "kind": "returned",
  "subject": "af1b76cf7eab52dc7",
  "session_id": "8a347c36-20b4-427a-ae0b-46855aa7bb72",
  "at": "2026-07-27T14:26:15Z",
  "outcome": "APPROVE",
  "findings": "0 Major, 1 minor, 3 nits. R2-m1 (minor, scripts/probes/ManifestBoardJoin.Probes.Tests.ps1:31-32): the corrected paragraph's sentence \"What wireschema_test.go DOES assert ... : gates-lane count and RecordDir/Findings, trains-lane count/tickets/RecordDir\" is introduced as an enumeration but omits that test's own headline purpose - validation of the marshalled snapshot against schema/yard-snapshot.schema.json under the pinned validator (wireschema_test.go:77-85, its own header at :13-19), which this probe does not do at all - plus the #28 wire-config assertions (:91-96) and the dispatches-lane orphan recordDir assertion (:143-151). This is the R1-M1 class inverted and was created by the R1-M1 fix; held to minor because everything the sentence states is true and line 40-41's \"alongside (never in place of) wireschema_test.go's own coverage\" closes the delete-the-redundant-test risk. R2-n1 (nit, line 26): the cited reproduction command go test ./server -run TestAssembledSnapshotValidatesAgainstWireSchema fails from the repo root (measured: go: cannot find main module) and succeeds from board/ (measured: ok, 1.176s); it needs its working directory stated. R2-n2 (nit, lines 66-67): the deferred CI step-ordering decision names the conductor as owner but no ticket, while issue #10 is open and is that exact subject. R2-n3 (nit, line 29): issue #79 is quoted with \"together\" capitalised to \"TOGETHER\" inside the quotation marks. All six round-1 IDs FOLDED, none DRIFTED: R1-M1 fixed with residual R2-m1; R1-m1 four-to-five corrected with no residue; R1-m2 disclosed as a decision with an owner and accurate measured facts; R1-m3 scoped two-sided, affirming Law 6 correctness while stating the seal is unguarded; R1-n1 producer added and verified at board/store/store.go:127; R1-n2 repointed at the AST-verified New-ScratchStore switches and the landed verdict path, plus the car's self-found GatesRoleOverride to GateARole correction which I verified against the parameter block. Convergence: 1M/3m/2n to 0M/1m/3n - two of three swirl triggers technically fire (same-section clustering, a defect created by a prior fix) but I explicitly rule NOT swirl and set no cap, because severity collapsed from a false absolute to a guarded incompleteness and five of six IDs closed with zero residue.",
  "abstract": "Delta review round 2 of a3579c4 over round-1 HEAD c1c4d2d, one file, 55 insertions 11 deletions. The governing check was the comments-only claim, and I proved it two ways rather than by eye: every one of the 66 changed lines matches a comment pattern, and the PowerShell parser's own token stream with comments and newlines excluded is byte-identical across the two blobs - 1718 tokens each, both hashing d7cf49bd720a278f9e7682b36d6931abe51a97eefe654566122a61a968e38cf4 - so the executable program is provably unchanged and round 1's non-vacuity proof carries. Suites at a3579c4: scripts/probes 29 passed 0 failed 0 skipped; scripts/tests 222 passed 0 failed 5 skipped with the extra skip again named as SessionStartGuardRunner's branch-attached ci-baseline case; CodeCitationPolicy 13/13. I still spent one empirical touch on the unchanged-code claim, rebuilding the out-of-repo checkout copy and breaking the real join in board/assemble/assemble.go, and the gates assertion red by name with the source restored byte-identical. The corrected R1-M1 paragraph was tested claim by claim rather than read: I instrumented a copy of wireschema_test.go and observed declaredNotObserved empty at length zero, and observed the pipeline producing gate name \"design review round 1\" and outcome REJECT that the Go test never asserts, confirming both the \"fixture declares no unobserved member\" claim and the \"verdict word and gate name verbatim\" addition; grep confirmed no board/server test asserts assigned. A mechanical sweep resolved all fifteen path citations in the file, the one miss being the round-1 verdict which I confirmed exists at 3eb1bf3, an ancestor of origin/dev and present at its tip, so it resolves post-merge - acceptable, not dangling. The car's self-found parameter-name fix was verified by extracting New-ScratchStore's parameters from the AST: all five injection names now resolve, GatesRoleOverride appears nowhere. Approved with one minor - the fix paragraph now under-states what the Go test covers, the same Law 1 class inverted, held below Major because its own \"never in place of\" clause closes the risk - and three nits. Debris clean across every run; I wrote nothing to the repo, all injection ran on out-of-repo copies with restore hashes recorded. Separately recommended as a ticket, not a change here: board/web/test/support/real-board-server.js:528 derives its port from the PID modulo 200 with four portless callers, which is the fixed-port collision surface, and this probe's port-zero plus parse-the-listening-line pattern is the landed exemplar to port.",
  "subject_basis": "runtime-id",
  "task_id": "probe-79-review-r2",
  "producer": "starcar-hook/1",
  "normalisation": [],
  "integrity": "sha256:79d086def7898df65d9f9249d16ed42f9a007d1513aae7697eec54f388a7097b"
}
