{
  "schema": "starcar-artifact/1",
  "kind": "returned",
  "subject": "ae17d6a1ac77dc264",
  "session_id": "15c84ef1-8e84-4d98-aacd-17cce34752cb",
  "at": "2026-07-26T14:55:44Z",
  "outcome": "CONFIRM",
  "findings": "0 Major, 4 Minor.\n  F1 (Minor, ticket required) - two surviving instances of the class this commit names, one grep away.\n    scripts/probes/SubstrateFloor.Probes.Tests.ps1:98 splits PATH on a hardcoded ';' and reports GREEN on\n    the ubuntu leg of run 30206223085 having stripped nothing (proven: split of a colon-PATH yields 1\n    element, filter keeps it, join is identity). That falsifies issue #14's own thesis that the probe suite\n    \"either passes on Linux or names exactly what breaks\". scripts/tests/LandVerdictRider.Tests.ps1:78 is\n    the same shape but fails LOUDLY via its probe-invalid guard at :83. Not Major against this diff: both\n    pre-date 81df6cc, and fixing them inside the hotfix would have broken legs (a) and (b). Recommend the\n    mechanical form; prior art already in-repo at docs/templates/repo-policy-check-patterns.md section 1.\n  F2 (Minor) - docs/friction-log.md:219,224 claims the ubuntu leg \"caught what no desk review could\" and\n    that five rounds \"could not have seen it\". Disproved by\n    artifacts/reviews/2026-07-26-tooling-50-32-review-round1-REJECT.md:180, where a reviewer examined this\n    exact PATH-stripping helper for CI portability and cleared it with \"No finding.\" A hardcoded separator\n    is a STRUCTURAL fact, settled by reading. The overstatement forecloses the review-side lesson that\n    would have caught F1.\n  F3 (Minor) - commit 81df6cc leg (c) says the red was observed \"in the only environment that can exhibit\n    it\". False: WSL Ubuntu-24.04 is installed on this box and reproduced the failure end-to-end, byte-exact\n    fallback JSON included, in one command. Leg still satisfied; the clause is not true.\n  F4 (Minor) - \"182/182\" omits the attached-vs-detached coordinate. Both numbers reconciled (attached\n    182/0/0; detached 181/0/1 of 182, skip = the ci-baseline conditional) so the claim is TRUE for the\n    conductor's environment. Raised because round 4's verdict at :274 graded this exact omission a\n    verification-honesty VIOLATION two days earlier.\n  Cleared: SessionStartGuardRunner.Tests.ps1:53-56's four un-chmodded fixtures are correctly exempt\n    (run-session-start-guards.sh:69 invokes them as `sh FILE`; probed on Linux, works at 0644, direct exec\n    gives rc=126). [regex]::Escape is identity for both separators. docs/setup.md:108-110 still true.\n  Reviewer self-disclosure: my first fault injection wrote to the SHARED checkout because .NET static file\n    APIs ignore Set-Location. Caught by an impossible hash match, restored byte-identically (both checkouts\n    verified clean), the meaningless result discarded, injection redone with absolute paths. This exact\n    mistake is already recorded at docs/friction-log.md:198-206 from two days ago - I am the second\n    reviewer to make it, which is itself evidence that a prose-only lesson does not bind.",
  "abstract": "BINDING post-hoc adversarial review of conductor hotfix 81df6cc (per-OS PATH separator plus exec\n  bit in the entire-stub test helper). VERDICT CONFIRM - the hotfix stands, no rework-forward. All five legs\n  of the conductor-hotfix exception genuinely exhibited and verified leg by leg. Leg (a): run 30205842313 at\n  42e3eae, ubuntu-latest failure / windows-latest success, failing test and symptom verbatim as described.\n  Leg (b): 2 files, +26/-2, test helper internals plus friction log, zero product code, hook under test\n  untouched. Leg (c): I did not accept the commit message's causal chain - I re-derived it on real Linux via\n  WSL Ubuntu-24.04 and isolated each defect independently (colon sep without exec bit NOTFOUND; semicolon\n  sep with exec bit NOTFOUND; both fixed FOUND), then reproduced the CI failure end-to-end with the exact\n  fallback JSON. Both defects are independently sufficient, so both fixes were necessary. Leg (d) disclosure\n  complete in structure, two accuracy defects raised. Leg (e) is this review. Fault injection: restored the\n  hardcoded ';' and observed 9/9 PASS on Windows, reverted byte-identically by SHA-256 - the defect is\n  Windows-invisible and Linux-fatal, validating the friction log's class claim; corroborated by the\n  windows-latest leg being green at 42e3eae with both defects live. Suites I ran myself at HEAD: scripts/tests\n  181 passed / 0 failed / 1 skipped / 182 total detached, 182/0/0 attached; SessionStartWiring 9/9. Four\n  Minors, zero Majors, so no Major-equals-REJECT trigger. The substantive open item is F1: the commit's own\n  friction-log entry states a universal class rule while two violations sit one grep away, one of them\n  producing a vacuously green probe on the very CI leg this incident vindicated - it needs a ticket and\n  preferably a repo-policy gate rather than another prose entry.",
  "subject_basis": "runtime-id",
  "task_id": "hotfix-stub-review-r1",
  "producer": "starcar-hook/1",
  "normalisation": [],
  "integrity": "sha256:ec9d21173985425a2fd5920ae3757b660d5dba82735d4e2bad375113fcf32f9f"
}
