{
  "schema": "starcar-artifact/1",
  "kind": "returned",
  "subject": "ae3d64acd969fcdf2",
  "session_id": "8a347c36-20b4-427a-ae0b-46855aa7bb72",
  "at": "2026-07-27T12:31:01Z",
  "outcome": "done",
  "findings": "0 Major, 0 Minor (all 5 round-2 findings fixed and verified; 1 disclosed out-of-scope observation for the record, not fixed, per the round's swirl cap)",
  "abstract": "|\n  Fix cycle round 3 on view train #69+#71, all 5 findings from\n  artifacts/reviews/2026-07-27-view-69-71-review-r2-REJECT.md addressed,\n  red-first, on car/view-69-71 base 2861bfd through HEAD 4b50a5c, 3 commits\n  (8073f0b, 9b899ab, 4b50a5c), working tree clean.\n\n  MAJOR-R2-1: .solari-row no longer sets flex-wrap (round 2's fix wrapped\n  the subject/state/elapsed cluster too, not just the disclosure, doubling\n  every row's height and re-cropping .solari-rows mid-row). The cluster now\n  lives in its own non-wrapping wrapper (.solari-row-main); .solari-row is\n  a column-direction flex container stacking main then the disclosure by\n  DOM order, needing no wrap. New browser-dispatch-row-geometry.test.js\n  asserts rendered geometry via real Chromium/real Go binary - verified\n  non-vacuous by stashing the fix, rerunning the finalized test against\n  round-2 HEAD, observing red for the stated reason (2 visual lines instead\n  of 1; a plain row cropping mid-row), then restoring (sha256 identical)\n  and green (3/3).\n\n  MAJOR-R2-2: the stale \"(line 141)\" citation (false the instant round 2's\n  own insertion moved the target) converted to symbol form. Audited every\n  other bare line-number reference the round-2 commits added: found and\n  fixed one more (condition-open-state.test.js), verified two others\n  accurate and left alone (both in files this train never edits).\n\n  MAJOR-R2-3: corrected the false claim that ingest.js's validator gates\n  superseded[] items - measured with the real vendored validator that a\n  malformed item validates clean, because $defs.lane.data is never $ref'd\n  to the payload defs (the schema's own $comment already explains this\n  design posture, untouched). The renderer's own filter is the entire\n  runtime protection.\n\n  MINOR-R2-1: new test pins the owner-ruled collapsed-by-default posture -\n  non-vacuity proven by injecting an open attribute, observing red, then\n  restoring byte-identical.\n\n  MINOR-R2-2: replaced the tautological closest().contains() witness with\n  a falsifiable form (closest(...) === ownRow, descendant check, bounding-\n  box containment), all measured true live, and pointed at dom-writer.\n  test.js's structural tests as the re-runnable proof. Recaptured\n  screenshots using a multi-row fixture (the old single-subject fixture\n  cannot visually exhibit MAJOR-R2-1 at all - disclosed). Also disclosed,\n  found incidentally: a pre-existing CSS-grid row-band-stretch cosmetic\n  artifact at wide viewports, out of scope for this round's five named\n  findings, not fixed, flagged for the record given the round's swirl cap.\n\n  Final suite totals at HEAD 4b50a5c: Go board/... 94 PASS / 0 FAIL\n  (unchanged, no Go files touched), go vet clean; Node board/web 212 tests\n  / 212 pass / 0 fail (round-2 final 208 + 4 new); Pester scripts/tests 223\n  passed / 0 failed / 4 skipped / 227 total (matches round-2 final\n  exactly); Pester scripts/probes 24/24; probe-yard-snapshot.mjs PASS.\n  Byte-clean exit, no scratch-store debris.",
  "subject_basis": "runtime-id",
  "task_id": "view-69-71-car-r3",
  "producer": "starcar-hook/1",
  "normalisation": [],
  "integrity": "sha256:2c464043038f798ccb57910c734aaad2ab12f0549d2e3f705b61fecc2bbadad1"
}
