{
  "schema": "starcar-artifact/1",
  "kind": "dispatched",
  "subject": "afe18ef8acbb02719",
  "session_id": "8a347c36-20b4-427a-ae0b-46855aa7bb72",
  "at": "2026-07-27T16:25:12Z",
  "budget": 1800.0,
  "model": "claude-opus-5[1m]",
  "subject_basis": "runtime-id",
  "producer": "starcar-hook/1",
  "normalisation": [],
  "integrity": "sha256:cf9331fb1c09985714eceabefc07b287026cc522c82c6012973b26cf22c7f085"
}
